{"$schema":"https://json-schema.org/draft/2020-12/schema","title":"Accommodations","type":"array","items":{"type":"object","required":["date","destination","hotel","bookingStatus","checkIn","checkOut","bookingReference","notes"],"properties":{"date":{"type":"string"},"destination":{"type":"string"},"hotel":{"type":"string"},"bookingStatus":{"type":"string"},"checkIn":{"type":"string"},"checkOut":{"type":"string"},"bookingReference":{"type":"string"},"notes":{"type":"string"}}}}
