[
  { "date": "22-24 ago", "destination": "Bangkok", "hotel": "Por decidir", "bookingStatus": "Pendiente", "checkIn": "22 ago por la tarde", "checkOut": "24 ago", "bookingReference": "-", "notes": "Preferible cerca de transporte." },
  { "date": "25-28 ago", "destination": "Chiang Mai", "hotel": "Por decidir", "bookingStatus": "Pendiente", "checkIn": "25 ago", "checkOut": "28 ago", "bookingReference": "-", "notes": "Old City o Nimman." },
  { "date": "28-31 ago", "destination": "Koh Tao", "hotel": "Por decidir", "bookingStatus": "Pendiente", "checkIn": "28 ago", "checkOut": "31 ago", "bookingReference": "-", "notes": "Sairee o Mae Haad." },
  { "date": "31 ago-1 sept", "destination": "Krabi", "hotel": "Por decidir", "bookingStatus": "Pendiente", "checkIn": "31 ago", "checkOut": "1 sept", "bookingReference": "-", "notes": "Ao Nang es práctico." },
  { "date": "1-2 sept", "destination": "Phi Phi", "hotel": "Por decidir", "bookingStatus": "Pendiente", "checkIn": "1 sept", "checkOut": "2 sept", "bookingReference": "-", "notes": "Evitar zona ruidosa si es posible." },
  { "date": "2-4 sept", "destination": "Krabi", "hotel": "Por decidir", "bookingStatus": "Pendiente", "checkIn": "2 sept", "checkOut": "4 sept", "bookingReference": "-", "notes": "Buen acceso al aeropuerto." },
  { "date": "4-5 sept", "destination": "Bangkok", "hotel": "Por decidir", "bookingStatus": "Pendiente", "checkIn": "4 sept", "checkOut": "5 sept", "bookingReference": "-", "notes": "Zona práctica para compras y transporte." }
]
